<!ELEMENT employee (entry)*>
<!ELEMENT entry (srno, name, designation, salary)>
<!ELEMENT srno (#PCDATA)>
<!ELEMENT name (#PCDATA)>
<!ELEMENT designation (#PCDATA)>
<!ELEMENT salary (#PCDATA)>
